Unnamed: 0,created_at,id_str,full_text,quote_count,reply_count,retweet_count,favorite_count,lang,user_id_str,conversation_id_str,username,tweet_url,cleansing,remove_emojis,case_folding,tokenizing,stemming_list,stemming,negation,formalization,stopword_list,stopword_removal,english_comment,vader_sentiment
348,Fri Dec 15 03:43:00 +0000 2023,1.7355057110929782e+18,"@AndisBoga @muchlis_ar Wkwkww. Narasinya salah. Anies gagal di konvensi demokrat, di ambil jokowi sebagai jubir, diangkat mendikbud, di buang jokowi kemudian daftar pilkada minta bantuan gerindra, jadi gubernur, selesai jabatan 5 tahun, diambil SP buat capres. Gak ada berkhianatnya deh",0.0,0,0.0,0.0,in,320671693.0,1.73485939707417e+18,muhamadrdani,https://twitter.com/muhamadrdani/status/1735505711092978173,AndisBoga  muchlis ar Wkwkww  Narasinya salah  Anies gagal di konvensi demokrat  di ambil jokowi sebagai jubir  diangkat mendikbud  di buang jokowi kemudian daftar pilkada minta bantuan gerindra  jadi gubernur  selesai jabatan tahun  diambil SP buat capres  Gak ada berkhianatnya deh,AndisBoga  muchlis ar Wkwkww  Narasinya salah  Anies gagal di konvensi demokrat  di ambil jokowi sebagai jubir  diangkat mendikbud  di buang jokowi kemudian daftar pilkada minta bantuan gerindra  jadi gubernur  selesai jabatan   tahun  diambil SP buat capres  Gak ada berkhianatnya deh,andisboga  muchlis ar wkwkww  narasinya salah  anies gagal di konvensi demokrat  di ambil jokowi sebagai jubir  diangkat mendikbud  di buang jokowi kemudian daftar pilkada minta bantuan gerindra  jadi gubernur  selesai jabatan tahun  diambil sp buat capres  gak ada berkhianatnya deh,"['andisboga', 'muchlis', 'ar', 'wkwkww', 'narasinya', 'salah', 'anies', 'gagal', 'di', 'konvensi', 'demokrat', 'di', 'ambil', 'jokowi', 'sebagai', 'jubir', 'diangkat', 'mendikbud', 'di', 'buang', 'jokowi', 'kemudian', 'daftar', 'pilkada', 'minta', 'bantuan', 'gerindra', 'jadi', 'gubernur', 'selesai', 'jabatan', 'tahun', 'diambil', 'sp', 'buat', 'capres', 'gak', 'ada', 'berkhianatnya', 'deh']","['andisboga', 'muchlis', 'ar', 'wkwkww', 'narasi', 'salah', 'anies', 'gagal', 'di', 'konvensi', 'demokrat', 'di', 'ambil', 'jokowi', 'bagai', 'jubir', 'angkat', 'mendikbud', 'di', 'buang', 'jokowi', 'kemudian', 'daftar', 'pilkada', 'minta', 'bantu', 'gerindra', 'jadi', 'gubernur', 'selesai', 'jabat', 'tahun', 'ambil', 'sp', 'buat', 'capres', 'gak', 'ada', 'khianat', 'deh']",andisboga muchlis ar wkwkww narasi salah anies gagal di konvensi demokrat di ambil jokowi bagai jubir angkat mendikbud di buang jokowi kemudian daftar pilkada minta bantu gerindra jadi gubernur selesai jabat tahun ambil sp buat capres gak ada khianat deh,"['andisboga', 'muchlis', 'ar', 'wkwkww', 'narasi', 'salah', 'anies', 'gagal', 'di', 'konvensi', 'demokrat', 'di', 'ambil', 'jokowi', 'bagai', 'jubir', 'angkat', 'mendikbud', 'di', 'buang', 'jokowi', 'kemudian', 'daftar', 'pilkada', 'minta', 'bantu', 'gerindra', 'jadi', 'gubernur', 'selesai', 'jabat', 'tahun', 'ambil', 'sp', 'buat', 'capres', 'tidak_ada', 'khianat', 'deh']","['andisboga', 'muchlis', 'ar', 'wkwkww', 'narasi', 'salah', 'anies', 'gagal', 'di', 'konvensi', 'demokrat', 'di', 'ambil', 'jokowi', 'bagai', 'juru bicara', 'angkat', 'mendikbud', 'di', 'buang', 'jokowi', 'kemudian', 'daftar', 'pemilihan kepala daerah', 'minta', 'bantu', 'gerindra', 'jadi', 'gubernur', 'selesai', 'jabat', 'tahun', 'ambil', 'sp', 'buat', 'capres', 'tidak_ada', 'khianat', 'deh']","['andisboga', 'muchlis', 'ar', 'wkwkww', 'narasi', 'salah', 'anies', 'gagal', 'konvensi', 'demokrat', 'ambil', 'jokowi', 'juru bicara', 'angkat', 'mendikbud', 'buang', 'jokowi', 'daftar', 'pemilihan kepala daerah', 'bantu', 'gerindra', 'gubernur', 'selesai', 'jabat', 'ambil', 'sp', 'capres', 'tidak', 'ada', 'khianat', 'deh']",andisboga muchlis ar wkwkww narasi salah anies gagal konvensi demokrat ambil jokowi juru bicara angkat mendikbud buang jokowi daftar pemilihan kepala daerah bantu gerindra gubernur selesai jabat ambil sp capres tidak ada khianat deh,andisboga muchlis ar wkwkww wrong narrative Anies failed democratic convention takes Jokowi spokesperson appoints minister of education and culture throws out Jokowi regional head election list helps Gerindra governor finishes office takes sp presidential candidate there is no betrayal,negative
349,Fri Dec 15 03:43:00 +0000 2023,1.7355057107615788e+18,"@ARSIPAJA bener kan jadinya yg dibilang pak Anies? wkwk nyalahin angin dikasus ini wajar, kecuali tembak menembak nyalahin angin agak laen...",0.0,0,0.0,0.0,in,2397505423.0,1.735467703262122e+18,ssenabluu,https://twitter.com/ssenabluu/status/1735505710761578785,ARSIPAJA bener kan jadinya yg dibilang pak Anies  wkwk nyalahin angin dikasus ini wajar  kecuali tembak menembak nyalahin angin agak laen,ARSIPAJA bener kan jadinya yg dibilang pak Anies  wkwk nyalahin angin dikasus ini wajar  kecuali tembak menembak nyalahin angin agak laen,arsipaja bener kan jadinya yg dibilang pak anies  wkwk nyalahin angin dikasus ini wajar  kecuali tembak menembak nyalahin angin agak laen,"['arsipaja', 'bener', 'kan', 'jadinya', 'yg', 'dibilang', 'pak', 'anies', 'wkwk', 'nyalahin', 'angin', 'dikasus', 'ini', 'wajar', 'kecuali', 'tembak', 'menembak', 'nyalahin', 'angin', 'agak', 'laen']","['arsipaja', 'bener', 'kan', 'jadi', 'yg', 'bilang', 'pak', 'anies', 'wkwk', 'nyalahin', 'angin', 'kasus', 'ini', 'wajar', 'kecuali', 'tembak', 'tembak', 'nyalahin', 'angin', 'agak', 'laen']",arsipaja bener kan jadi yg bilang pak anies wkwk nyalahin angin kasus ini wajar kecuali tembak tembak nyalahin angin agak laen,"['arsipaja', 'bener', 'kan', 'jadi', 'yg', 'bilang', 'pak', 'anies', 'wkwk', 'nyalahin', 'angin', 'kasus', 'ini', 'wajar', 'kecuali', 'tembak', 'tembak', 'nyalahin', 'angin', 'agak', 'laen']","['arsipaja', 'benar', 'kan', 'jadi', 'yang', 'bilang', 'pak', 'anies', 'tertawa', 'nyalahin', 'angin', 'kasus', 'ini', 'wajar', 'kecuali', 'tembak', 'tembak', 'nyalahin', 'angin', 'agak', 'lain']","['arsipaja', 'bilang', 'anies', 'tertawa', 'nyalahin', 'angin', 'wajar', 'kecuali', 'tembak', 'tembak', 'nyalahin', 'angin']",arsipaja bilang anies tertawa nyalahin angin wajar kecuali tembak tembak nyalahin angin,"Archives said that Anies laughing and blaming the wind is normal except when shooting, blaming the wind",negative
358,Fri Dec 15 03:42:33 +0000 2023,1.7355055967687844e+18,@02Sukiman @Imade_kun @hasmibakhtiar Punya prinsip baik koq disebut sombong ðŸ™ƒ  Ngaji lg sana,0.0,1,0.0,0.0,in,164778726.0,1.7354414460718697e+18,dusrimulya,https://twitter.com/dusrimulya/status/1735505596768784459,Sukiman  Imade kun  hasmibakhtiar Punya prinsip baik koq disebut sombong Ngaji lg sana,Sukiman  Imade kun  hasmibakhtiar Punya prinsip baik koq disebut sombong   Ngaji lg sana,sukiman  imade kun  hasmibakhtiar punya prinsip baik koq disebut sombong ngaji lg sana,"['sukiman', 'imade', 'kun', 'hasmibakhtiar', 'punya', 'prinsip', 'baik', 'koq', 'disebut', 'sombong', 'ngaji', 'lg', 'sana']","['sukiman', 'imade', 'kun', 'hasmibakhtiar', 'punya', 'prinsip', 'baik', 'koq', 'sebut', 'sombong', 'ngaji', 'lg', 'sana']",sukiman imade kun hasmibakhtiar punya prinsip baik koq sebut sombong ngaji lg sana,"['sukiman', 'imade', 'kun', 'hasmibakhtiar', 'punya', 'prinsip', 'baik', 'koq', 'sebut', 'sombong', 'ngaji', 'lg', 'sana']","['sukiman', 'imade', 'kun', 'hasmibakhtiar', 'punya', 'prinsip', 'baik', 'kok', 'sebut', 'sombong', 'ngaji', 'lagi', 'sana']","['sukiman', 'imade', 'kun', 'hasmibakhtiar', 'prinsip', 'sombong', 'ngaji']",sukiman imade kun hasmibakhtiar prinsip sombong ngaji,sukiman imade kun hasmibakhtiar principle of being arrogant about reciting the Koran,negative
365,Fri Dec 15 03:41:47 +0000 2023,1.7355054069890993e+18,"@itsquaileggs Bacot lo blok banyak buzzer ganjar yg sm ky buzzer anies sm2 ngmg prestasi sm2 ngatain lawan tpi yg lu repost ya cm anies,ganjar cm ngmg respect,liat aja timeline sendiri jgn munafik lo bangke sok keras lg ðŸ¤£",0.0,1,0.0,0.0,in,1.4167316835297116e+18,1.735445863840019e+18,Rkle11,https://twitter.com/Rkle11/status/1735505406989099348,itsquaileggs Bacot lo blok banyak buzzer ganjar yg sm ky buzzer anies sm  ngmg prestasi sm  ngatain lawan tpi yg lu repost ya cm anies ganjar cm ngmg respect liat aja timeline sendiri jgn munafik lo bangke sok keras lg ,itsquaileggs Bacot lo blok banyak buzzer ganjar yg sm ky buzzer anies sm  ngmg prestasi sm  ngatain lawan tpi yg lu repost ya cm anies ganjar cm ngmg respect liat aja timeline sendiri jgn munafik lo bangke sok keras lg ,itsquaileggs bacot lo blok banyak buzzer ganjar yg sm ky buzzer anies sm  ngmg prestasi sm  ngatain lawan tpi yg lu repost ya cm anies ganjar cm ngmg respect liat aja timeline sendiri jgn munafik lo bangke sok keras lg ,"['itsquaileggs', 'bacot', 'lo', 'blok', 'banyak', 'buzzer', 'ganjar', 'yg', 'sm', 'ky', 'buzzer', 'anies', 'sm', 'ngmg', 'prestasi', 'sm', 'ngatain', 'lawan', 'tpi', 'yg', 'lu', 'repost', 'ya', 'cm', 'anies', 'ganjar', 'cm', 'ngmg', 'respect', 'liat', 'aja', 'timeline', 'sendiri', 'jgn', 'munafik', 'lo', 'bangke', 'sok', 'keras', 'lg']","['itsquaileggs', 'bacot', 'lo', 'blok', 'banyak', 'buzzer', 'ganjar', 'yg', 'sm', 'ky', 'buzzer', 'anies', 'sm', 'ngmg', 'prestasi', 'sm', 'ngatain', 'lawan', 'tpi', 'yg', 'lu', 'repost', 'ya', 'cm', 'anies', 'ganjar', 'cm', 'ngmg', 'respect', 'liat', 'aja', 'timeline', 'sendiri', 'jgn', 'munafik', 'lo', 'bangke', 'sok', 'keras', 'lg']",itsquaileggs bacot lo blok banyak buzzer ganjar yg sm ky buzzer anies sm ngmg prestasi sm ngatain lawan tpi yg lu repost ya cm anies ganjar cm ngmg respect liat aja timeline sendiri jgn munafik lo bangke sok keras lg,"['itsquaileggs', 'bacot', 'lo', 'blok', 'banyak', 'buzzer', 'ganjar', 'yg', 'sm', 'ky', 'buzzer', 'anies', 'sm', 'ngmg', 'prestasi', 'sm', 'ngatain', 'lawan', 'tpi', 'yg', 'lu', 'repost', 'ya', 'cm', 'anies', 'ganjar', 'cm', 'ngmg', 'respect', 'liat', 'aja', 'timeline', 'sendiri', 'jgn', 'munafik', 'lo', 'bangke', 'sok', 'keras', 'lg']","['itsquaileggs', 'banyak bicara', 'kamu', 'bodoh', 'banyak', 'buzzer', 'ganjar', 'yang', 'sm', 'seperti', 'buzzer', 'anies', 'sm', 'bicara', 'prestasi', 'sm', 'ngatain', 'lawan', 'tapi', 'yang', 'kamu', 'repost', 'iya', 'cm', 'anies', 'ganjar', 'cm', 'bicara', 'respect', 'lihat', 'saja', 'timeline', 'sendiri', 'jangan', 'munafik', 'kamu', 'bangkai', 'sok', 'keras', 'lagi']","['itsquaileggs', 'banyak bicara', 'bodoh', 'buzzer', 'ganjar', 'sm', 'buzzer', 'anies', 'sm', 'bicara', 'prestasi', 'sm', 'ngatain', 'lawan', 'repost', 'iya', 'cm', 'anies', 'ganjar', 'cm', 'bicara', 'respect', 'lihat', 'timeline', 'munafik', 'bangkai', 'sok', 'keras']",itsquaileggs banyak bicara bodoh buzzer ganjar sm buzzer anies sm bicara prestasi sm ngatain lawan repost iya cm anies ganjar cm bicara respect lihat timeline munafik bangkai sok keras,itsquaileggs talks a lot stupid buzzer gajar sm buzzer anies sm talks about achievements sm defends opponents repost yes cm anies gajar cm talks about respect look at timeline hypocritical carcass pretends to be tough,negative
378,Fri Dec 15 03:40:59 +0000 2023,1.735505204106457e+18,"@Resty_J_Cayah @prabawo Intinya anies itu maha benar, apapun kesalahannya pasti ada jawaban pembenaran, udah itu aja.",0.0,0,0.0,0.0,in,894748674.0,1.735249426548224e+18,VaganzaAries,https://twitter.com/VaganzaAries/status/1735505204106457387,Resty Cayah  prabawo Intinya anies itu maha benar  apapun kesalahannya pasti ada jawaban pembenaran  udah itu aja,Resty   Cayah  prabawo Intinya anies itu maha benar  apapun kesalahannya pasti ada jawaban pembenaran  udah itu aja,resty cayah  prabawo intinya anies itu maha benar  apapun kesalahannya pasti ada jawaban pembenaran  udah itu aja,"['resty', 'cayah', 'prabawo', 'intinya', 'anies', 'itu', 'maha', 'benar', 'apapun', 'kesalahannya', 'pasti', 'ada', 'jawaban', 'pembenaran', 'udah', 'itu', 'aja']","['resty', 'cayah', 'prabawo', 'inti', 'anies', 'itu', 'maha', 'benar', 'apa', 'salah', 'pasti', 'ada', 'jawab', 'benar', 'udah', 'itu', 'aja']",resty cayah prabawo inti anies itu maha benar apa salah pasti ada jawab benar udah itu aja,"['resty', 'cayah', 'prabawo', 'inti', 'anies', 'itu', 'maha', 'benar', 'apa', 'salah', 'pasti', 'ada', 'jawab', 'benar', 'udah', 'itu', 'aja']","['resty', 'cayah', 'prabawo', 'inti', 'anies', 'itu', 'maha', 'benar', 'apa', 'salah', 'pasti', 'ada', 'jawab', 'benar', 'sudah', 'itu', 'saja']","['resty', 'cayah', 'prabawo', 'inti', 'anies', 'maha', 'salah']",resty cayah prabawo inti anies maha salah,Resty Cayah Prabawo Inti Anies is absolutely wrong,negative
391,Fri Dec 15 03:40:08 +0000 2023,1.7355049914300298e+18,"@Hasbil_Lbs @aniesbaswedan ya anies mah emg gabakalan menang bang, gw jg berani taruhan 1 M ðŸ˜",0.0,0,0.0,0.0,in,1.135851282214736e+18,1.735408605833331e+18,gamispendek,https://twitter.com/gamispendek/status/1735504991430029749,Hasbil Lbs  aniesbaswedan ya anies mah emg gabakalan menang bang  gw jg berani taruhan ,Hasbil Lbs  aniesbaswedan ya anies mah emg gabakalan menang bang  gw jg berani taruhan     ,hasbil lbs  aniesbaswedan ya anies mah emg gabakalan menang bang  gw jg berani taruhan ,"['hasbil', 'lbs', 'aniesbaswedan', 'ya', 'anies', 'mah', 'emg', 'gabakalan', 'menang', 'bang', 'gw', 'jg', 'berani', 'taruhan']","['hasbil', 'lbs', 'aniesbaswedan', 'ya', 'anies', 'mah', 'emg', 'gabakalan', 'menang', 'bang', 'gw', 'jg', 'berani', 'taruh']",hasbil lbs aniesbaswedan ya anies mah emg gabakalan menang bang gw jg berani taruh,"['hasbil', 'lbs', 'aniesbaswedan', 'ya', 'anies', 'mah', 'emg', 'gabakalan', 'menang', 'bang', 'gw', 'jg', 'berani', 'taruh']","['hasbil', 'lbs', 'aniesbaswedan', 'iya', 'anies', 'mah', 'emg', 'gabakalan', 'menang', 'bang', 'saya', 'juga', 'berani', 'taruh']","['hasbil', 'lbs', 'aniesbaswedan', 'iya', 'anies', 'mah', 'emg', 'gabakalan', 'menang', 'bang', 'berani', 'taruh']",hasbil lbs aniesbaswedan iya anies mah emg gabakalan menang bang berani taruh,"Aniesbaswed's LBS results and yes, Anies is not going to win, bro, dare I bet",negative
397,Fri Dec 15 03:39:59 +0000 2023,1.7355049532282885e+18,"Survei IPSOS (15-29 Nov), Prabowo-Gibran melonjak 11%, Ganjar-Mahfud turun 9% &amp  Anies-Muhaimin turun 6% dibanding survei 17-19 Okto:  AB-MI 28,91% -&gt  22,13% GP-MMD 31,98% -&gt  22,95% PS-GRR 31,32% -&gt  42,66% Undecided 7,79% -&gt  12,26%  https://t.co/KQJjy0lPmG https://t.co/g3TgwztZRS",0.0,0,0.0,0.0,in,508535668.0,1.7355049532282885e+18,TopanTj,https://twitter.com/TopanTj/status/1735504953228288297,Survei IPSOS Nov Prabowo Gibran melonjak  %  Ganjar Mahfud turun  % &amp  Anies Muhaimin turun  % dibanding survei Okto AB MI %  &gt % GP MMD %  &gt % PS GRR %  &gt % Undecided %  &gt %,Survei IPSOS      Nov   Prabowo Gibran melonjak  %  Ganjar Mahfud turun  % &amp  Anies Muhaimin turun  % dibanding survei     Okto   AB MI    %  &gt     % GP MMD    %  &gt     % PS GRR    %  &gt     % Undecided    %  &gt     %,survei ipsos nov prabowo gibran melonjak  %  ganjar mahfud turun  % &amp  anies muhaimin turun  % dibanding survei okto ab mi %  &gt % gp mmd %  &gt % ps grr %  &gt % undecided %  &gt %,"['survei', 'ipsos', 'nov', 'prabowo', 'gibran', 'melonjak', '%', 'ganjar', 'mahfud', 'turun', '%', '&', 'amp', 'anies', 'muhaimin', 'turun', '%', 'dibanding', 'survei', 'okto', 'ab', 'mi', '%', '&', 'gt', '%', 'gp', 'mmd', '%', '&', 'gt', '%', 'ps', 'grr', '%', '&', 'gt', '%', 'undecided', '%', '&', 'gt', '%']","['survei', 'ipsos', 'nov', 'prabowo', 'gibran', 'lonjak', '', 'ganjar', 'mahfud', 'turun', '', '', 'amp', 'anies', 'muhaimin', 'turun', '', 'banding', 'survei', 'okto', 'ab', 'mi', '', '', 'gt', '', 'gp', 'mmd', '', '', 'gt', '', 'ps', 'grr', '', '', 'gt', '', 'undecided', '', '', 'gt', '']",survei ipsos nov prabowo gibran lonjak  ganjar mahfud turun   amp anies muhaimin turun  banding survei okto ab mi   gt  gp mmd   gt  ps grr   gt  undecided   gt ,"['survei', 'ipsos', 'nov', 'prabowo', 'gibran', 'lonjak', '', 'ganjar', 'mahfud', 'turun', '', '', 'amp', 'anies', 'muhaimin', 'turun', '', 'banding', 'survei', 'okto', 'ab', 'mi', '', '', 'gt', '', 'gp', 'mmd', '', '', 'gt', '', 'ps', 'grr', '', '', 'gt', '', 'undecided', '', '', 'gt', '']","['survei', 'ipsos', 'nov', 'prabowo', 'gibran', 'lonjak', '', 'ganjar', 'mahfud', 'turun', '', '', 'amp', 'anies', 'muhaimin', 'turun', '', 'banding', 'survei', 'okto', 'ab', 'mi', '', '', 'begitu', '', 'gp', 'mmd', '', '', 'begitu', '', 'ps', 'grr', '', '', 'begitu', '', 'undecided', '', '', 'begitu', '']","['survei', 'ipsos', 'nov', 'prabowo', 'gibran', 'lonjak', '', 'ganjar', 'mahfud', 'turun', '', '', 'amp', 'anies', 'muhaimin', 'turun', '', 'banding', 'survei', 'okto', 'ab', 'mi', '', '', '', 'gp', 'mmd', '', '', '', 'ps', 'grr', '', '', '', 'undecided', '', '', '']",survei ipsos nov prabowo gibran lonjak  ganjar mahfud turun   amp anies muhaimin turun  banding survei okto ab mi    gp mmd    ps grr    undecided   ,ipsos survey nov prabowo gibran lonjak Ganjar mahfud down amp anies muhaimin down appeal octo survey ab mi gp mmd ps grr undecided,negative
404,Fri Dec 15 03:39:15 +0000 2023,1.7355047692871232e+18,"@Catatan_ali7 @Masinton Di Wonogiri, baliho pragib juga dirusak kok, banyak tapi ga semua. Pelakunya pasti bukan pendukung anies",0.0,0,0.0,0.0,in,1.5634375020897034e+18,1.7355041490293023e+18,PoernoAdiNug,https://twitter.com/PoernoAdiNug/status/1735504769287123308,Catatan ali Masinton Di Wonogiri  baliho pragib juga dirusak kok  banyak tapi ga semua  Pelakunya pasti bukan pendukung anies,Catatan ali   Masinton Di Wonogiri  baliho pragib juga dirusak kok  banyak tapi ga semua  Pelakunya pasti bukan pendukung anies,catatan ali masinton di wonogiri  baliho pragib juga dirusak kok  banyak tapi ga semua  pelakunya pasti bukan pendukung anies,"['catatan', 'ali', 'masinton', 'di', 'wonogiri', 'baliho', 'pragib', 'juga', 'dirusak', 'kok', 'banyak', 'tapi', 'ga', 'semua', 'pelakunya', 'pasti', 'bukan', 'pendukung', 'anies']","['catat', 'ali', 'masinton', 'di', 'wonogiri', 'baliho', 'pragib', 'juga', 'rusak', 'kok', 'banyak', 'tapi', 'ga', 'semua', 'laku', 'pasti', 'bukan', 'dukung', 'anies']",catat ali masinton di wonogiri baliho pragib juga rusak kok banyak tapi ga semua laku pasti bukan dukung anies,"['catat', 'ali', 'masinton', 'di', 'wonogiri', 'baliho', 'pragib', 'juga', 'rusak', 'kok', 'banyak', 'tapi', 'tidak_semua', 'laku', 'pasti', 'tidak_dukung', 'anies']","['catat', 'ali', 'masinton', 'di', 'wonogiri', 'baliho', 'pragib', 'juga', 'rusak', 'kok', 'banyak', 'tapi', 'tidak_semua', 'laku', 'pasti', 'tidak_dukung', 'anies']","['catat', 'ali', 'masinton', 'wonogiri', 'baliho', 'pragib', 'rusak', 'tidak', 'semua', 'laku', 'tidak', 'dukung', 'anies']",catat ali masinton wonogiri baliho pragib rusak tidak semua laku tidak dukung anies,"Ali Masinton notes Wonogiri Pragib billboards are damaged, not all of them are sold, they don't support Anies",negative
405,Fri Dec 15 03:39:13 +0000 2023,1.7355047605420442e+18,"@mardigu024 Anies adalah pendidik.Hanya orang bodoh, kerdil dan hina yg tidak mengerti atau susah mengerti apa yg dijelaskan Anies. Bahkan ada yg membenci dan memfitnahnya hanya karena dia cerdas. Sesimple itu sih. Hanya menjawab apa adanya, jgn baperan. ðŸ™ƒ",0.0,0,0.0,0.0,in,1.5461167625337774e+18,1.7351464802631685e+18,pippolippi22,https://twitter.com/pippolippi22/status/1735504760542044228,mardigu  Anies adalah pendidik Hanya orang bodoh  kerdil dan hina yg tidak mengerti atau susah mengerti apa yg dijelaskan Anies  Bahkan ada yg membenci dan memfitnahnya hanya karena dia cerdas  Sesimple itu sih  Hanya menjawab apa adanya  jgn baperan  ,mardigu  Anies adalah pendidik Hanya orang bodoh  kerdil dan hina yg tidak mengerti atau susah mengerti apa yg dijelaskan Anies  Bahkan ada yg membenci dan memfitnahnya hanya karena dia cerdas  Sesimple itu sih  Hanya menjawab apa adanya  jgn baperan  ,mardigu  anies adalah pendidik hanya orang bodoh  kerdil dan hina yg tidak mengerti atau susah mengerti apa yg dijelaskan anies  bahkan ada yg membenci dan memfitnahnya hanya karena dia cerdas  sesimple itu sih  hanya menjawab apa adanya  jgn baperan  ,"['mardigu', 'anies', 'adalah', 'pendidik', 'hanya', 'orang', 'bodoh', 'kerdil', 'dan', 'hina', 'yg', 'tidak', 'mengerti', 'atau', 'susah', 'mengerti', 'apa', 'yg', 'dijelaskan', 'anies', 'bahkan', 'ada', 'yg', 'membenci', 'dan', 'memfitnahnya', 'hanya', 'karena', 'dia', 'cerdas', 'sesimple', 'itu', 'sih', 'hanya', 'menjawab', 'apa', 'adanya', 'jgn', 'baperan']","['mardigu', 'anies', 'adalah', 'didik', 'hanya', 'orang', 'bodoh', 'kerdil', 'dan', 'hina', 'yg', 'tidak', 'erti', 'atau', 'susah', 'erti', 'apa', 'yg', 'jelas', 'anies', 'bahkan', 'ada', 'yg', 'benci', 'dan', 'fitnah', 'hanya', 'karena', 'dia', 'cerdas', 'sesimple', 'itu', 'sih', 'hanya', 'jawab', 'apa', 'ada', 'jgn', 'baperan']",mardigu anies adalah didik hanya orang bodoh kerdil dan hina yg tidak erti atau susah erti apa yg jelas anies bahkan ada yg benci dan fitnah hanya karena dia cerdas sesimple itu sih hanya jawab apa ada jgn baperan,"['mardigu', 'anies', 'adalah', 'didik', 'hanya', 'orang', 'bodoh', 'kerdil', 'dan', 'hina', 'yg', 'tidak_erti', 'atau', 'susah', 'erti', 'apa', 'yg', 'jelas', 'anies', 'bahkan', 'ada', 'yg', 'benci', 'dan', 'fitnah', 'hanya', 'karena', 'dia', 'cerdas', 'sesimple', 'itu', 'sih', 'hanya', 'jawab', 'apa', 'ada', 'jgn', 'baperan']","['mardigu', 'anies', 'adalah', 'didik', 'hanya', 'orang', 'bodoh', 'kerdil', 'dan', 'hina', 'yang', 'tidak_erti', 'atau', 'susah', 'erti', 'apa', 'yang', 'jelas', 'anies', 'bahkan', 'ada', 'yang', 'benci', 'dan', 'fitnah', 'hanya', 'karena', 'dia', 'cerdas', 'sesimple', 'itu', 'sih', 'hanya', 'jawab', 'apa', 'ada', 'jangan', 'baperan']","['mardigu', 'anies', 'didik', 'orang', 'bodoh', 'kerdil', 'hina', 'tidak', 'erti', 'susah', 'erti', 'anies', 'benci', 'fitnah', 'cerdas', 'sesimple', 'sih', 'baperan']",mardigu anies didik orang bodoh kerdil hina tidak erti susah erti anies benci fitnah cerdas sesimple sih baperan,Mardigu Anies educates stupid people lowly dwarfs don't understand difficult to understand Anies hates slander intelligent as simple as blasÃ©,negative
406,Fri Dec 15 03:39:12 +0000 2023,1.735504754112189e+18,"@guttebening @ARSIPAJA Kami ga mungkin pilih 02, grup wa emak2 aja masih pada benci sama dia. Yg bikin trauma itu pendukung anies yg di pilkada terakhir teriakan ganyang ahok, penggal leher, sangat bikin tidak tenang. Makanya saya milih golput, tidak rela mendukung siapapun",0.0,0,0.0,0.0,in,73716060.0,1.7353047729815186e+18,chadlvn,https://twitter.com/chadlvn/status/1735504754112188628,guttebening  ARSIPAJA Kami ga mungkin pilih grup wa emak  aja masih pada benci sama dia  Yg bikin trauma itu pendukung anies yg di pilkada terakhir teriakan ganyang ahok  penggal leher  sangat bikin tidak tenang  Makanya saya milih golput  tidak rela mendukung siapapun,guttebening  ARSIPAJA Kami ga mungkin pilih    grup wa emak  aja masih pada benci sama dia  Yg bikin trauma itu pendukung anies yg di pilkada terakhir teriakan ganyang ahok  penggal leher  sangat bikin tidak tenang  Makanya saya milih golput  tidak rela mendukung siapapun,guttebening  arsipaja kami ga mungkin pilih grup wa emak  aja masih pada benci sama dia  yg bikin trauma itu pendukung anies yg di pilkada terakhir teriakan ganyang ahok  penggal leher  sangat bikin tidak tenang  makanya saya milih golput  tidak rela mendukung siapapun,"['guttebening', 'arsipaja', 'kami', 'ga', 'mungkin', 'pilih', 'grup', 'wa', 'emak', 'aja', 'masih', 'pada', 'benci', 'sama', 'dia', 'yg', 'bikin', 'trauma', 'itu', 'pendukung', 'anies', 'yg', 'di', 'pilkada', 'terakhir', 'teriakan', 'ganyang', 'ahok', 'penggal', 'leher', 'sangat', 'bikin', 'tidak', 'tenang', 'makanya', 'saya', 'milih', 'golput', 'tidak', 'rela', 'mendukung', 'siapapun']","['guttebening', 'arsipaja', 'kami', 'ga', 'mungkin', 'pilih', 'grup', 'wa', 'emak', 'aja', 'masih', 'pada', 'benci', 'sama', 'dia', 'yg', 'bikin', 'trauma', 'itu', 'dukung', 'anies', 'yg', 'di', 'pilkada', 'akhir', 'ria', 'ganyang', 'ahok', 'penggal', 'leher', 'sangat', 'bikin', 'tidak', 'tenang', 'makanya', 'saya', 'milih', 'golput', 'tidak', 'rela', 'dukung', 'siapa']",guttebening arsipaja kami ga mungkin pilih grup wa emak aja masih pada benci sama dia yg bikin trauma itu dukung anies yg di pilkada akhir ria ganyang ahok penggal leher sangat bikin tidak tenang makanya saya milih golput tidak rela dukung siapa,"['guttebening', 'arsipaja', 'kami', 'tidak_mungkin', 'pilih', 'grup', 'wa', 'emak', 'aja', 'masih', 'pada', 'benci', 'sama', 'dia', 'yg', 'bikin', 'trauma', 'itu', 'dukung', 'anies', 'yg', 'di', 'pilkada', 'akhir', 'ria', 'ganyang', 'ahok', 'penggal', 'leher', 'sangat', 'bikin', 'tidak_tenang', 'makanya', 'saya', 'milih', 'golput', 'tidak_rela', 'dukung', 'siapa']","['guttebening', 'arsipaja', 'kami', 'tidak_mungkin', 'pilih', 'grup', 'whatsapp', 'emak', 'saja', 'masih', 'pada', 'benci', 'sama', 'dia', 'yang', 'bikin', 'trauma', 'itu', 'dukung', 'anies', 'yang', 'di', 'pemilihan kepala daerah', 'akhir', 'ria', 'ganyang', 'ahok', 'penggal', 'leher', 'sangat', 'bikin', 'tidak_tenang', 'makanya', 'saya', 'milih', 'golongan putih', 'tidak_rela', 'dukung', 'siapa']","['guttebening', 'arsipaja', 'tidak', 'mungkin', 'pilih', 'grup', 'whatsapp', 'emak', 'benci', 'bikin', 'trauma', 'dukung', 'anies', 'pemilihan kepala daerah', 'ria', 'ganyang', 'ahok', 'penggal', 'leher', 'bikin', 'tidak', 'tenang', 'milih', 'golongan putih', 'tidak', 'rela', 'dukung']",guttebening arsipaja tidak mungkin pilih grup whatsapp emak benci bikin trauma dukung anies pemilihan kepala daerah ria ganyang ahok penggal leher bikin tidak tenang milih golongan putih tidak rela dukung,guttebening archiveaja it's impossible to vote for whatsapp group mom hates it causes trauma support anies regional head election ria beat Ahok cut off neck makes you uneasy vote for white group not willing to support,negative
