Unnamed: 0,created_at,id_str,full_text,quote_count,reply_count,retweet_count,favorite_count,lang,user_id_str,conversation_id_str,username,tweet_url,cleansing,remove_emojis,case_folding,tokenizing,stemming_list,stemming,negation,formalization,stopword_list,stopword_removal,english_comment,vader_sentiment
97,Fri Dec 15 03:59:24 +0000 2023,1.7355098398399534e+18,"@are_inismyname @99propaganda @bengkeldodo @Ndons_Back @adri_7i @AndreasSolusi @mpoklela7 @florieliciouss @Kimberley_2024 @Bank_Joee_ @BANGSAygSUJUD Ibarat pertandingan sepak bola. Suporter yang kalah pasti kecewa,ngomel tidak bahagia dan mencari cari kesalahan musuh.  Itulah yang dialami kubu prabowo dan ganjar.  Hanya pendukung team anies yng bahagia saat ini",0.0,0,0.0,0.0,in,1.7190017750916137e+18,1.735288587921564e+18,Noy763164478823,https://twitter.com/Noy763164478823/status/1735509839839953398,are inismyname propaganda  bengkeldodo  Ndons Back  adri AndreasSolusi  mpoklela florieliciouss  Kimberley Bank Joee BANGSAygSUJUD Ibarat pertandingan sepak bola  Suporter yang kalah pasti kecewa ngomel tidak bahagia dan mencari cari kesalahan musuh Itulah yang dialami kubu prabowo dan ganjar Hanya pendukung team anies yng bahagia saat ini,are inismyname   propaganda  bengkeldodo  Ndons Back  adri     AndreasSolusi  mpoklela   florieliciouss  Kimberley    Bank Joee   BANGSAygSUJUD Ibarat pertandingan sepak bola  Suporter yang kalah pasti kecewa ngomel tidak bahagia dan mencari cari kesalahan musuh   Itulah yang dialami kubu prabowo dan ganjar   Hanya pendukung team anies yng bahagia saat ini,are inismyname propaganda  bengkeldodo  ndons back  adri andreassolusi  mpoklela florieliciouss  kimberley bank joee bangsaygsujud ibarat pertandingan sepak bola  suporter yang kalah pasti kecewa ngomel tidak bahagia dan mencari cari kesalahan musuh itulah yang dialami kubu prabowo dan ganjar hanya pendukung team anies yng bahagia saat ini,"['are', 'inismyname', 'propaganda', 'bengkeldodo', 'ndons', 'back', 'adri', 'andreassolusi', 'mpoklela', 'florieliciouss', 'kimberley', 'bank', 'joee', 'bangsaygsujud', 'ibarat', 'pertandingan', 'sepak', 'bola', 'suporter', 'yang', 'kalah', 'pasti', 'kecewa', 'ngomel', 'tidak', 'bahagia', 'dan', 'mencari', 'cari', 'kesalahan', 'musuh', 'itulah', 'yang', 'dialami', 'kubu', 'prabowo', 'dan', 'ganjar', 'hanya', 'pendukung', 'team', 'anies', 'yng', 'bahagia', 'saat', 'ini']","['are', 'inismyname', 'propaganda', 'bengkeldodo', 'ndons', 'back', 'adri', 'andreassolusi', 'mpoklela', 'florieliciouss', 'kimberley', 'bank', 'joee', 'bangsaygsujud', 'ibarat', 'tanding', 'sepak', 'bola', 'suporter', 'yang', 'kalah', 'pasti', 'kecewa', 'ngomel', 'tidak', 'bahagia', 'dan', 'cari', 'cari', 'salah', 'musuh', 'itu', 'yang', 'alami', 'kubu', 'prabowo', 'dan', 'ganjar', 'hanya', 'dukung', 'team', 'anies', 'yng', 'bahagia', 'saat', 'ini']",are inismyname propaganda bengkeldodo ndons back adri andreassolusi mpoklela florieliciouss kimberley bank joee bangsaygsujud ibarat tanding sepak bola suporter yang kalah pasti kecewa ngomel tidak bahagia dan cari cari salah musuh itu yang alami kubu prabowo dan ganjar hanya dukung team anies yng bahagia saat ini,"['are', 'inismyname', 'propaganda', 'bengkeldodo', 'ndons', 'back', 'adri', 'andreassolusi', 'mpoklela', 'florieliciouss', 'kimberley', 'bank', 'joee', 'bangsaygsujud', 'ibarat', 'tanding', 'sepak', 'bola', 'suporter', 'yang', 'kalah', 'pasti', 'kecewa', 'ngomel', 'tidak_bahagia', 'dan', 'cari', 'cari', 'salah', 'musuh', 'itu', 'yang', 'alami', 'kubu', 'prabowo', 'dan', 'ganjar', 'hanya', 'dukung', 'team', 'anies', 'yng', 'bahagia', 'saat', 'ini']","['are', 'inismyname', 'propaganda', 'bengkeldodo', 'ndons', 'kembali', 'adri', 'andreassolusi', 'mpoklela', 'florieliciouss', 'kimberley', 'bank', 'joee', 'bangsaygsujud', 'ibarat', 'tanding', 'sepak', 'bola', 'suporter', 'yang', 'kalah', 'pasti', 'kecewa', 'ngomel', 'tidak_bahagia', 'dan', 'cari', 'cari', 'salah', 'musuh', 'itu', 'yang', 'alami', 'kubu', 'prabowo', 'dan', 'ganjar', 'hanya', 'dukung', 'team', 'anies', 'yng', 'bahagia', 'saat', 'ini']","['are', 'inismyname', 'propaganda', 'bengkeldodo', 'ndons', 'adri', 'andreassolusi', 'mpoklela', 'florieliciouss', 'kimberley', 'bank', 'joee', 'bangsaygsujud', 'tanding', 'sepak', 'bola', 'suporter', 'kalah', 'kecewa', 'ngomel', 'tidak', 'bahagia', 'cari', 'cari', 'salah', 'musuh', 'alami', 'kubu', 'prabowo', 'ganjar', 'dukung', 'team', 'anies', 'yng', 'bahagia']",are inismyname propaganda bengkeldodo ndons adri andreassolusi mpoklela florieliciouss kimberley bank joee bangsaygsujud tanding sepak bola suporter kalah kecewa ngomel tidak bahagia cari cari salah musuh alami kubu prabowo ganjar dukung team anies yng bahagia,are inismyname propaganda workshopdodo ndons adri andreassollution mpoklela florieliciouss kimberley bank joee Bangsaygsprostrate football match supporters lose disappointed grumble unhappy looking for mistakes natural enemy Prabowo camp rewards support for happy anies team,negative
98,Fri Dec 15 03:59:20 +0000 2023,1.7355098233394998e+18,"@menghanyurkan Ini genuinely nanya : misal aku pilih Anies-Muhaimin, tp aku ga pilih legislatif dari PKS, nasdem dll nya karena contoh PKS dan ruu nya yg problematik gitu gimana?",0.0,0,0.0,1.0,in,1.1485881462856172e+18,1.7353907626934807e+18,ihrelevant,https://twitter.com/ihrelevant/status/1735509823339499867,menghanyurkan Ini genuinely nanya misal aku pilih Anies Muhaimin  tp aku ga pilih legislatif dari PKS  nasdem dll nya karena contoh PKS dan ruu nya yg problematik gitu gimana,menghanyurkan Ini genuinely nanya   misal aku pilih Anies Muhaimin  tp aku ga pilih legislatif dari PKS  nasdem dll nya karena contoh PKS dan ruu nya yg problematik gitu gimana,menghanyurkan ini genuinely nanya misal aku pilih anies muhaimin  tp aku ga pilih legislatif dari pks  nasdem dll nya karena contoh pks dan ruu nya yg problematik gitu gimana,"['menghanyurkan', 'ini', 'genuinely', 'nanya', 'misal', 'aku', 'pilih', 'anies', 'muhaimin', 'tp', 'aku', 'ga', 'pilih', 'legislatif', 'dari', 'pks', 'nasdem', 'dll', 'nya', 'karena', 'contoh', 'pks', 'dan', 'ruu', 'nya', 'yg', 'problematik', 'gitu', 'gimana']","['menghanyurkan', 'ini', 'genuinely', 'nanya', 'misal', 'aku', 'pilih', 'anies', 'muhaimin', 'tp', 'aku', 'ga', 'pilih', 'legislatif', 'dari', 'pks', 'nasdem', 'dll', 'nya', 'karena', 'contoh', 'pks', 'dan', 'ruu', 'nya', 'yg', 'problematik', 'gitu', 'gimana']",menghanyurkan ini genuinely nanya misal aku pilih anies muhaimin tp aku ga pilih legislatif dari pks nasdem dll nya karena contoh pks dan ruu nya yg problematik gitu gimana,"['menghanyurkan', 'ini', 'genuinely', 'nanya', 'misal', 'aku', 'pilih', 'anies', 'muhaimin', 'tp', 'aku', 'tidak_pilih', 'legislatif', 'dari', 'pks', 'nasdem', 'dll', 'nya', 'karena', 'contoh', 'pks', 'dan', 'ruu', 'nya', 'yg', 'problematik', 'gitu', 'gimana']","['menghanyurkan', 'ini', 'genuinely', 'bertanya', 'misal', 'aku', 'pilih', 'anies', 'muhaimin', 'tapi', 'aku', 'tidak_pilih', 'legislatif', 'dari', 'pks', 'nasdem', 'dan lain lain', 'nya', 'karena', 'contoh', 'pks', 'dan', 'ruu', 'nya', 'yang', 'problematik', 'gitu', 'bagaimana']","['menghanyurkan', 'genuinely', 'pilih', 'anies', 'muhaimin', 'tidak', 'pilih', 'legislatif', 'pks', 'nasdem', 'dan lain lain', 'nya', 'contoh', 'pks', 'ruu', 'nya', 'problematik', 'gitu']",menghanyurkan genuinely pilih anies muhaimin tidak pilih legislatif pks nasdem dan lain lain nya contoh pks ruu nya problematik gitu,"it's truly devastating to vote for Anies Muhaimin, not to vote for the PKS Nasdem legislature and other examples, the PKS bill is so problematic.",negative
100,Fri Dec 15 03:59:08 +0000 2023,1.735509773804835e+18,"Anies dengan angkuh ingin menegakan hukum, padahal kepada para pendukungnya bermasalah tidak berani tego . . . Gacoan olivia || Jill Biden Daesang || gempa Adidas || Surabaya BATTER UP 100M VIEWS || pilihan terbaik Melania BANGTAN DEBUT https://t.co/aw57jinZai",3.0,0,1.0,4.0,in,1.6257129232126484e+18,1.735509773804835e+18,fikarhmwtii,https://twitter.com/fikarhmwtii/status/1735509773804835058,Anies dengan angkuh ingin menegakan hukum  padahal kepada para pendukungnya bermasalah tidak berani tego Gacoan olivia Jill Biden Daesang gempa Adidas Surabaya BATTER UP VIEWS pilihan terbaik Melania BANGTAN DEBUT,Anies dengan angkuh ingin menegakan hukum  padahal kepada para pendukungnya bermasalah tidak berani tego       Gacoan olivia    Jill Biden Daesang    gempa Adidas    Surabaya BATTER UP    VIEWS    pilihan terbaik Melania BANGTAN DEBUT,anies dengan angkuh ingin menegakan hukum  padahal kepada para pendukungnya bermasalah tidak berani tego gacoan olivia jill biden daesang gempa adidas surabaya batter up views pilihan terbaik melania bangtan debut,"['anies', 'dengan', 'angkuh', 'ingin', 'menegakan', 'hukum', 'padahal', 'kepada', 'para', 'pendukungnya', 'bermasalah', 'tidak', 'berani', 'tego', 'gacoan', 'olivia', 'jill', 'biden', 'daesang', 'gempa', 'adidas', 'surabaya', 'batter', 'up', 'views', 'pilihan', 'terbaik', 'melania', 'bangtan', 'debut']","['anies', 'dengan', 'angkuh', 'ingin', 'tega', 'hukum', 'padahal', 'kepada', 'para', 'dukung', 'masalah', 'tidak', 'berani', 'tego', 'gaco', 'olivia', 'jill', 'biden', 'daesang', 'gempa', 'adidas', 'surabaya', 'batter', 'up', 'views', 'pilih', 'baik', 'melania', 'bangtan', 'debut']",anies dengan angkuh ingin tega hukum padahal kepada para dukung masalah tidak berani tego gaco olivia jill biden daesang gempa adidas surabaya batter up views pilih baik melania bangtan debut,"['anies', 'dengan', 'angkuh', 'ingin', 'tega', 'hukum', 'padahal', 'kepada', 'para', 'dukung', 'masalah', 'tidak_berani', 'tego', 'gaco', 'olivia', 'jill', 'biden', 'daesang', 'gempa', 'adidas', 'surabaya', 'batter', 'up', 'views', 'pilih', 'baik', 'melania', 'bangtan', 'debut']","['anies', 'dengan', 'angkuh', 'ingin', 'tega', 'hukum', 'padahal', 'kepada', 'para', 'dukung', 'masalah', 'tidak_berani', 'tego', 'gaco', 'olivia', 'jill', 'biden', 'daesang', 'gempa', 'adidas', 'surabaya', 'batter', 'up', 'views', 'pilih', 'baik', 'melania', 'bangtan', 'debut']","['anies', 'angkuh', 'tega', 'hukum', 'dukung', 'tidak', 'berani', 'tego', 'gaco', 'olivia', 'jill', 'biden', 'daesang', 'gempa', 'adidas', 'surabaya', 'batter', 'up', 'views', 'pilih', 'melania', 'bangtan', 'debut']",anies angkuh tega hukum dukung tidak berani tego gaco olivia jill biden daesang gempa adidas surabaya batter up views pilih melania bangtan debut,anies arrogantly upholds the law supports does not dare tego gaco olivia jill biden daesang earthquake adidas surabaya batter up views vote melania bangtan debut,negative
104,Fri Dec 15 03:58:59 +0000 2023,1.7355097329188045e+18,"@KantalDKintil @bukanasamgaram Tapi yg terjadi anggota mrk yg terbunuh kan 6 orang? Udah terbunuh ga dapet jabatan, Anies ga nolong. Klo mrk mau nyoblos dukung itu cm hak warga negara. Mau golput jg hak mrk. Selama mrk bukan genocide supporters or genocide actors, dan gak dikasih jabatan mrk ga bsa berbuat ap2",0.0,0,0.0,0.0,in,1.594320960479322e+18,1.7352799205643924e+18,ayachan10969__,https://twitter.com/ayachan10969__/status/1735509732918804563,KantalDKintil  bukanasamgaram Tapi yg terjadi anggota mrk yg terbunuh kan orang  Udah terbunuh ga dapet jabatan  Anies ga nolong  Klo mrk mau nyoblos dukung itu cm hak warga negara  Mau golput jg hak mrk  Selama mrk bukan genocide supporters or genocide actors  dan gak dikasih jabatan mrk ga bsa berbuat ap,KantalDKintil  bukanasamgaram Tapi yg terjadi anggota mrk yg terbunuh kan   orang  Udah terbunuh ga dapet jabatan  Anies ga nolong  Klo mrk mau nyoblos dukung itu cm hak warga negara  Mau golput jg hak mrk  Selama mrk bukan genocide supporters or genocide actors  dan gak dikasih jabatan mrk ga bsa berbuat ap,kantaldkintil  bukanasamgaram tapi yg terjadi anggota mrk yg terbunuh kan orang  udah terbunuh ga dapet jabatan  anies ga nolong  klo mrk mau nyoblos dukung itu cm hak warga negara  mau golput jg hak mrk  selama mrk bukan genocide supporters or genocide actors  dan gak dikasih jabatan mrk ga bsa berbuat ap,"['kantaldkintil', 'bukanasamgaram', 'tapi', 'yg', 'terjadi', 'anggota', 'mrk', 'yg', 'terbunuh', 'kan', 'orang', 'udah', 'terbunuh', 'ga', 'dapet', 'jabatan', 'anies', 'ga', 'nolong', 'klo', 'mrk', 'mau', 'nyoblos', 'dukung', 'itu', 'cm', 'hak', 'warga', 'negara', 'mau', 'golput', 'jg', 'hak', 'mrk', 'selama', 'mrk', 'bukan', 'genocide', 'supporters', 'or', 'genocide', 'actors', 'dan', 'gak', 'dikasih', 'jabatan', 'mrk', 'ga', 'bsa', 'berbuat', 'ap']","['kantaldkintil', 'bukanasamgaram', 'tapi', 'yg', 'jadi', 'anggota', 'mrk', 'yg', 'bunuh', 'kan', 'orang', 'udah', 'bunuh', 'ga', 'dapet', 'jabat', 'anies', 'ga', 'nolong', 'klo', 'mrk', 'mau', 'nyoblos', 'dukung', 'itu', 'cm', 'hak', 'warga', 'negara', 'mau', 'golput', 'jg', 'hak', 'mrk', 'lama', 'mrk', 'bukan', 'genocide', 'supporters', 'or', 'genocide', 'actors', 'dan', 'gak', 'kasih', 'jabat', 'mrk', 'ga', 'bsa', 'buat', 'ap']",kantaldkintil bukanasamgaram tapi yg jadi anggota mrk yg bunuh kan orang udah bunuh ga dapet jabat anies ga nolong klo mrk mau nyoblos dukung itu cm hak warga negara mau golput jg hak mrk lama mrk bukan genocide supporters or genocide actors dan gak kasih jabat mrk ga bsa buat ap,"['kantaldkintil', 'bukanasamgaram', 'tapi', 'yg', 'jadi', 'anggota', 'mrk', 'yg', 'bunuh', 'kan', 'orang', 'udah', 'bunuh', 'tidak_dapet', 'jabat', 'anies', 'tidak_nolong', 'klo', 'mrk', 'mau', 'nyoblos', 'dukung', 'itu', 'cm', 'hak', 'warga', 'negara', 'mau', 'golput', 'jg', 'hak', 'mrk', 'lama', 'mrk', 'tidak_genocide', 'supporters', 'or', 'genocide', 'actors', 'dan', 'tidak_kasih', 'jabat', 'mrk', 'tidak_bsa', 'buat', 'ap']","['kantaldkintil', 'bukanasamgaram', 'tapi', 'yang', 'jadi', 'anggota', 'mrk', 'yang', 'bunuh', 'kan', 'orang', 'sudah', 'bunuh', 'tidak_dapat', 'jabat', 'anies', 'tidak_nolong', 'kalau', 'mrk', 'mau', 'mencoblos', 'dukung', 'itu', 'cm', 'hak', 'warga', 'negara', 'mau', 'golongan putih', 'juga', 'hak', 'mrk', 'lama', 'mrk', 'tidak_genocide', 'supporters', 'or', 'genocide', 'actors', 'dan', 'tidak_kasih', 'jabat', 'mrk', 'tidak_bisa', 'buat', 'apa']","['kantaldkintil', 'bukanasamgaram', 'anggota', 'mrk', 'bunuh', 'orang', 'bunuh', 'tidak', 'dapat', 'jabat', 'anies', 'tidak', 'nolong', 'mrk', 'mencoblos', 'dukung', 'cm', 'hak', 'warga', 'negara', 'golongan putih', 'hak', 'mrk', 'mrk', 'tidak', 'genocide', 'supporters', 'or', 'genocide', 'actors', 'tidak', 'kasih', 'jabat', 'mrk', 'tidak', 'bisa']",kantaldkintil bukanasamgaram anggota mrk bunuh orang bunuh tidak dapat jabat anies tidak nolong mrk mencoblos dukung cm hak warga negara golongan putih hak mrk mrk tidak genocide supporters or genocide actors tidak kasih jabat mrk tidak bisa,kantaldkintil not acidsalt their members kill people kill can't hold office anies don't help them vote support cm rights of white citizens their rights they don't genocide supporters or genocide actors don't give office they can't,negative
116,Fri Dec 15 03:58:40 +0000 2023,1.735509652950106e+18,"Serangan apalagi yg akan dikerjakan si memed hari ini @PartaiSocmed  Buzzer ayah di semua medsos setelah debat KPU serangannya kalap sekali ðŸ˜¬ðŸ˜¬ðŸ˜¬ Di rl ternyata sudah ada hasil. Prabowo cenderung negatif, Anies pelan2 sudah banyak dibicarakan semua kalangan.Titik cerah",0.0,0,0.0,0.0,in,1.1612258976486482e+18,1.735509652950106e+18,Karebet_69,https://twitter.com/Karebet_69/status/1735509652950106143,Serangan apalagi yg akan dikerjakan si memed hari ini  PartaiSocmed  Buzzer ayah di semua medsos setelah debat KPU serangannya kalap sekali  Di rl ternyata sudah ada hasil  Prabowo cenderung negatif  Anies pelan  sudah banyak dibicarakan semua kalangan Titik cerah,Serangan apalagi yg akan dikerjakan si memed hari ini  PartaiSocmed  Buzzer ayah di semua medsos setelah debat KPU serangannya kalap sekali  Di rl ternyata sudah ada hasil  Prabowo cenderung negatif  Anies pelan  sudah banyak dibicarakan semua kalangan Titik cerah,serangan apalagi yg akan dikerjakan si memed hari ini  partaisocmed  buzzer ayah di semua medsos setelah debat kpu serangannya kalap sekali  di rl ternyata sudah ada hasil  prabowo cenderung negatif  anies pelan  sudah banyak dibicarakan semua kalangan titik cerah,"['serangan', 'apalagi', 'yg', 'akan', 'dikerjakan', 'si', 'memed', 'hari', 'ini', 'partaisocmed', 'buzzer', 'ayah', 'di', 'semua', 'medsos', 'setelah', 'debat', 'kpu', 'serangannya', 'kalap', 'sekali', 'di', 'rl', 'ternyata', 'sudah', 'ada', 'hasil', 'prabowo', 'cenderung', 'negatif', 'anies', 'pelan', 'sudah', 'banyak', 'dibicarakan', 'semua', 'kalangan', 'titik', 'cerah']","['serang', 'apalagi', 'yg', 'akan', 'kerja', 'si', 'memed', 'hari', 'ini', 'partaisocmed', 'buzzer', 'ayah', 'di', 'semua', 'medsos', 'telah', 'debat', 'kpu', 'serang', 'kalap', 'sekali', 'di', 'rl', 'nyata', 'sudah', 'ada', 'hasil', 'prabowo', 'cenderung', 'negatif', 'anies', 'pelan', 'sudah', 'banyak', 'bicara', 'semua', 'kalang', 'titik', 'cerah']",serang apalagi yg akan kerja si memed hari ini partaisocmed buzzer ayah di semua medsos telah debat kpu serang kalap sekali di rl nyata sudah ada hasil prabowo cenderung negatif anies pelan sudah banyak bicara semua kalang titik cerah,"['serang', 'apalagi', 'yg', 'akan', 'kerja', 'si', 'memed', 'hari', 'ini', 'partaisocmed', 'buzzer', 'ayah', 'di', 'semua', 'medsos', 'telah', 'debat', 'kpu', 'serang', 'kalap', 'sekali', 'di', 'rl', 'nyata', 'sudah', 'ada', 'hasil', 'prabowo', 'cenderung', 'negatif', 'anies', 'pelan', 'sudah', 'banyak', 'bicara', 'semua', 'kalang', 'titik', 'cerah']","['serang', 'apalagi', 'yang', 'akan', 'kerja', 'si', 'memed', 'hari', 'ini', 'partaisocmed', 'buzzer', 'ayah', 'di', 'semua', 'media sosial', 'telah', 'debat', 'kpu', 'serang', 'kalap', 'sekali', 'di', 'rl', 'nyata', 'sudah', 'ada', 'hasil', 'prabowo', 'cenderung', 'negatif', 'anies', 'pelan', 'sudah', 'banyak', 'bicara', 'semua', 'kalang', 'titik', 'cerah']","['serang', 'kerja', 'si', 'memed', 'partaisocmed', 'buzzer', 'ayah', 'media sosial', 'debat', 'kpu', 'serang', 'kalap', 'rl', 'nyata', 'hasil', 'prabowo', 'cenderung', 'negatif', 'anies', 'pelan', 'bicara', 'kalang', 'titik', 'cerah']",serang kerja si memed partaisocmed buzzer ayah media sosial debat kpu serang kalap rl nyata hasil prabowo cenderung negatif anies pelan bicara kalang titik cerah,attack on work at memed party socmed buzzer father social media debate KPU attack crazy rl real Prabowo results tend to be negative Anies talks slowly in a frenzy bright spots,negative
123,Fri Dec 15 03:58:17 +0000 2023,1.7355095588006625e+18,@sobat_anies @PartaiSocmed Fans bole otak pakai  Kenyataan jadi hoax Hoax kalian buat jd kenyataan ðŸ¤£ðŸ¤£ðŸ¤£  Yg nonton bnyk,0.0,0,0.0,0.0,in,1703433084.0,1.7352861267081503e+18,Semot_x_Abang,https://twitter.com/Semot_x_Abang/status/1735509558800662536,sobat anies  PartaiSocmed Fans bole otak pakai  Kenyataan jadi hoax Hoax kalian buat jd kenyataan Yg nonton bnyk,sobat anies  PartaiSocmed Fans bole otak pakai  Kenyataan jadi hoax Hoax kalian buat jd kenyataan   Yg nonton bnyk,sobat anies  partaisocmed fans bole otak pakai  kenyataan jadi hoax hoax kalian buat jd kenyataan yg nonton bnyk,"['sobat', 'anies', 'partaisocmed', 'fans', 'bole', 'otak', 'pakai', 'kenyataan', 'jadi', 'hoax', 'hoax', 'kalian', 'buat', 'jd', 'kenyataan', 'yg', 'nonton', 'bnyk']","['sobat', 'anies', 'partaisocmed', 'fans', 'bole', 'otak', 'pakai', 'nyata', 'jadi', 'hoax', 'hoax', 'kalian', 'buat', 'jd', 'nyata', 'yg', 'nonton', 'bnyk']",sobat anies partaisocmed fans bole otak pakai nyata jadi hoax hoax kalian buat jd nyata yg nonton bnyk,"['sobat', 'anies', 'partaisocmed', 'fans', 'bole', 'otak', 'pakai', 'nyata', 'jadi', 'hoax', 'hoax', 'kalian', 'buat', 'jd', 'nyata', 'yg', 'nonton', 'bnyk']","['sobat', 'anies', 'partaisocmed', 'fans', 'boleh', 'otak', 'pakai', 'nyata', 'jadi', 'isu bohong', 'isu bohong', 'kalian', 'buat', 'jadi', 'nyata', 'yang', 'nonton', 'banyak']","['sobat', 'anies', 'partaisocmed', 'fans', 'otak', 'pakai', 'nyata', 'isu bohong', 'isu bohong', 'nyata', 'nonton']",sobat anies partaisocmed fans otak pakai nyata isu bohong isu bohong nyata nonton,"Friends, Anies Partaisocmed, brain fans use real, fake issues, real fake issues, watch",negative
131,Fri Dec 15 03:57:50 +0000 2023,1.7355094463387036e+18,"@NdrewsTjan @itsquaileggs Ampun ama ni orang benci ke fpi, hrs dan gerombolan nya yg kena anies, dulu yg kena tuduh memobilisasi 212 keluarga cikeas, eh pangeran cikeas kalah putaran pertama, yg kena anies lagi.",0.0,0,0.0,0.0,in,1.3248617426235187e+18,1.735445863840019e+18,Malikamenard6,https://twitter.com/Malikamenard6/status/1735509446338703527,NdrewsTjan  itsquaileggs Ampun ama ni orang benci ke fpi  hrs dan gerombolan nya yg kena anies  dulu yg kena tuduh memobilisasi keluarga cikeas  eh pangeran cikeas kalah putaran pertama  yg kena anies lagi,NdrewsTjan  itsquaileggs Ampun ama ni orang benci ke fpi  hrs dan gerombolan nya yg kena anies  dulu yg kena tuduh memobilisasi   keluarga cikeas  eh pangeran cikeas kalah putaran pertama  yg kena anies lagi,ndrewstjan  itsquaileggs ampun ama ni orang benci ke fpi  hrs dan gerombolan nya yg kena anies  dulu yg kena tuduh memobilisasi keluarga cikeas  eh pangeran cikeas kalah putaran pertama  yg kena anies lagi,"['ndrewstjan', 'itsquaileggs', 'ampun', 'ama', 'ni', 'orang', 'benci', 'ke', 'fpi', 'hrs', 'dan', 'gerombolan', 'nya', 'yg', 'kena', 'anies', 'dulu', 'yg', 'kena', 'tuduh', 'memobilisasi', 'keluarga', 'cikeas', 'eh', 'pangeran', 'cikeas', 'kalah', 'putaran', 'pertama', 'yg', 'kena', 'anies', 'lagi']","['ndrewstjan', 'itsquaileggs', 'ampun', 'ama', 'ni', 'orang', 'benci', 'ke', 'fpi', 'hrs', 'dan', 'gerombol', 'nya', 'yg', 'kena', 'anies', 'dulu', 'yg', 'kena', 'tuduh', 'mobilisasi', 'keluarga', 'cikeas', 'eh', 'pangeran', 'cikeas', 'kalah', 'putar', 'pertama', 'yg', 'kena', 'anies', 'lagi']",ndrewstjan itsquaileggs ampun ama ni orang benci ke fpi hrs dan gerombol nya yg kena anies dulu yg kena tuduh mobilisasi keluarga cikeas eh pangeran cikeas kalah putar pertama yg kena anies lagi,"['ndrewstjan', 'itsquaileggs', 'ampun', 'ama', 'ni', 'orang', 'benci', 'ke', 'fpi', 'hrs', 'dan', 'gerombol', 'nya', 'yg', 'kena', 'anies', 'dulu', 'yg', 'kena', 'tuduh', 'mobilisasi', 'keluarga', 'cikeas', 'eh', 'pangeran', 'cikeas', 'kalah', 'putar', 'pertama', 'yg', 'kena', 'anies', 'lagi']","['ndrewstjan', 'itsquaileggs', 'ampun', 'sama', 'ini', 'orang', 'benci', 'ke', 'fpi', 'harus', 'dan', 'gerombol', 'nya', 'yang', 'kena', 'anies', 'dulu', 'yang', 'kena', 'tuduh', 'mobilisasi', 'keluarga', 'cikeas', 'eh', 'pangeran', 'cikeas', 'kalah', 'putar', 'pertama', 'yang', 'kena', 'anies', 'lagi']","['ndrewstjan', 'itsquaileggs', 'ampun', 'orang', 'benci', 'fpi', 'gerombol', 'nya', 'kena', 'anies', 'kena', 'tuduh', 'mobilisasi', 'keluarga', 'cikeas', 'eh', 'pangeran', 'cikeas', 'kalah', 'putar', 'kena', 'anies']",ndrewstjan itsquaileggs ampun orang benci fpi gerombol nya kena anies kena tuduh mobilisasi keluarga cikeas eh pangeran cikeas kalah putar kena anies,"ndrewstjan itsquaileggs, sorry, people hate FPI, the gang got hit by Anies, got accused of mobilizing the Cikeas family, eh, the Prince of Cikeas lost and got hit by Anies",negative
